Term,Overlap,P-value,Adjusted P-value,Old P-value,Old Adjusted P-value,Odds Ratio,Combined Score,Genes
production of small RNA involved in gene silencing by RNA (GO:0070918),20-Jan,0.217778604,0.41220439,0,0,4.274853801,6.516058384,TSNAX
cell morphogenesis involved in differentiation (GO:0000904),2/72,0.219256108,0.413968622,0,0,2.32420307,3.527012533,PEAK1;ACTN1
Fc-gamma receptor signaling pathway (GO:0038094),2/72,0.219256108,0.413968622,0,0,2.32420307,3.527012533,PAK1;ARPC1B
defense response to virus (GO:0051607),3/133,0.221548832,0.417277906,0,0,1.87928503,2.832293501,NDUFAF4;FLNA;PHB
regulation of actin filament polymerization (GO:0030833),2/73,0.223745746,0.417277906,0,0,2.291351414,3.430714302,MTPN;HAX1
chromatin assembly (GO:0031497),2/73,0.223745746,0.417277906,0,0,2.291351414,3.430714302,HMGA2;NOC2L
positive regulation of JNK cascade (GO:0046330),2/73,0.223745746,0.417277906,0,0,2.291351414,3.430714302,TRAF3;IL1B
endomembrane system organization (GO:0010256),4/199,0.225741525,0.417277906,0,0,1.671880342,2.488367566,NSFL1C;SEC23IP;REEP3;SURF4
actin nucleation (GO:0045010),21-Jan,0.227331244,0.417277906,0,0,4.06090535,6.015610371,ARPC1B
negative regulation of cell communication (GO:0010648),21-Jan,0.227331244,0.417277906,0,0,4.06090535,6.015610371,IL1B
purinergic nucleotide receptor signaling pathway (GO:0035590),21-Jan,0.227331244,0.417277906,0,0,4.06090535,6.015610371,IL1B
regulation of anoikis (GO:2000209),21-Jan,0.227331244,0.417277906,0,0,4.06090535,6.015610371,MYBBP1A
regulation of cardiac muscle contraction by calcium ion signaling (GO:0010882),21-Jan,0.227331244,0.417277906,0,0,4.06090535,6.015610371,GSTO1
regulation of cell-substrate junction assembly (GO:0090109),21-Jan,0.227331244,0.417277906,0,0,4.06090535,6.015610371,PEAK1
cellular response to estradiol stimulus (GO:0071392),21-Jan,0.227331244,0.417277906,0,0,4.06090535,6.015610371,RUVBL2
chondroitin sulfate biosynthetic process (GO:0030206),21-Jan,0.227331244,0.417277906,0,0,4.06090535,6.015610371,CHPF
regulation of lipid catabolic process (GO:0050994),21-Jan,0.227331244,0.417277906,0,0,4.06090535,6.015610371,IL1B
regulation of lipoprotein lipase activity (GO:0051004),21-Jan,0.227331244,0.417277906,0,0,4.06090535,6.015610371,ANGPTL4
nuclear envelope organization (GO:0006998),21-Jan,0.227331244,0.417277906,0,0,4.06090535,6.015610371,REEP3
regulation of transcription by RNA polymerase III (GO:0006359),21-Jan,0.227331244,0.417277906,0,0,4.06090535,6.015610371,POLR3G
regulation of transposition (GO:0010528),21-Jan,0.227331244,0.417277906,0,0,4.06090535,6.015610371,SMYD5
response to glucagon (GO:0033762),21-Jan,0.227331244,0.417277906,0,0,4.06090535,6.015610371,PRKAR2A
positive regulation of lipid storage (GO:0010884),21-Jan,0.227331244,0.417277906,0,0,4.06090535,6.015610371,EHD1
positive regulation of T cell cytokine production (GO:0002726),21-Jan,0.227331244,0.417277906,0,0,4.06090535,6.015610371,IL1B
myotube differentiation (GO:0014902),21-Jan,0.227331244,0.417277906,0,0,4.06090535,6.015610371,ADAM12
protein localization to chromatin (GO:0071168),21-Jan,0.227331244,0.417277906,0,0,4.06090535,6.015610371,RUVBL2
protein-containing complex assembly (GO:0065003),5/267,0.227927459,0.417436207,0,0,1.556581175,2.301759954,SEC23IP;CNIH1;ZNHIT6;TSPAN4;MDN1
regulation of stress fiber assembly (GO:0051492),2/74,0.228242458,0.417436207,0,0,2.259412305,3.33793554,PAK1;MET
Fc receptor mediated stimulatory signaling pathway (GO:0002431),2/74,0.228242458,0.417436207,0,0,2.259412305,3.33793554,PAK1;ARPC1B
amino acid import (GO:0043090),22-Jan,0.236767697,0.423707342,0,0,3.867332941,5.571572977,SFXN1
negative regulation of lipid biosynthetic process (GO:0051055),22-Jan,0.236767697,0.423707342,0,0,3.867332941,5.571572977,PRMT3
negative regulation of protein dephosphorylation (GO:0035308),22-Jan,0.236767697,0.423707342,0,0,3.867332941,5.571572977,TIPRL
cellular response to nerve growth factor stimulus (GO:1990090),22-Jan,0.236767697,0.423707342,0,0,3.867332941,5.571572977,EHD1
neuronal action potential (GO:0019228),22-Jan,0.236767697,0.423707342,0,0,3.867332941,5.571572977,SCN5A
regulation of macrophage chemotaxis (GO:0010758),22-Jan,0.236767697,0.423707342,0,0,3.867332941,5.571572977,CSF1
osteoclast differentiation (GO:0030316),22-Jan,0.236767697,0.423707342,0,0,3.867332941,5.571572977,CSF1
positive regulation of amyloid precursor protein catabolic process (GO:1902993),22-Jan,0.236767697,0.423707342,0,0,3.867332941,5.571572977,GSAP
positive regulation of calcium ion transmembrane transporter activity (GO:1901021),22-Jan,0.236767697,0.423707342,0,0,3.867332941,5.571572977,GSTO1
female gonad development (GO:0008585),22-Jan,0.236767697,0.423707342,0,0,3.867332941,5.571572977,EIF2B5
glutamate metabolic process (GO:0006536),22-Jan,0.236767697,0.423707342,0,0,3.867332941,5.571572977,ALDH18A1
glutathione derivative biosynthetic process (GO:1901687),22-Jan,0.236767697,0.423707342,0,0,3.867332941,5.571572977,GSTO1
glutathione derivative metabolic process (GO:1901685),22-Jan,0.236767697,0.423707342,0,0,3.867332941,5.571572977,GSTO1
positive regulation of lipid catabolic process (GO:0050996),22-Jan,0.236767697,0.423707342,0,0,3.867332941,5.571572977,IL1B
positive regulation of peptidase activity (GO:0010952),22-Jan,0.236767697,0.423707342,0,0,3.867332941,5.571572977,PSME3
positive regulation of translational initiation (GO:0045948),22-Jan,0.236767697,0.423707342,0,0,3.867332941,5.571572977,EIF2B5
regulation of cell division (GO:0051302),2/76,0.237253782,0.423707342,0,0,2.198123744,3.162275552,SMYD5;CSPP1
establishment of protein localization to organelle (GO:0072594),2/76,0.237253782,0.423707342,0,0,2.198123744,3.162275552,HK2;TNPO3
regulation of RNA splicing (GO:0043484),2/76,0.237253782,0.423707342,0,0,2.198123744,3.162275552,RRP1B;METTL16
water-soluble vitamin metabolic process (GO:0006767),2/76,0.237253782,0.423707342,0,0,2.198123744,3.162275552,GSTO1;MTHFD2
positive regulation of response to external stimulus (GO:0032103),3/139,0.240875691,0.429670151,0,0,1.795826214,2.556312436,IL1B;POLR3G;S100A8
proteasomal protein catabolic process (GO:0010498),4/205,0.241407775,0.430113852,0,0,1.621475954,2.304551503,NSFL1C;PSMD14;PSME3;PSMD3
import into nucleus (GO:0051170),2/77,0.241766776,0.430216944,0,0,2.168705234,3.079088116,SMN1;TNPO3
acylglycerol biosynthetic process (GO:0046463),23-Jan,0.246089372,0.430216944,0,0,3.691358025,5.175507315,LPGAT1
negative regulation of extrinsic apoptotic signaling pathway in absence of ligand (GO:2001240),23-Jan,0.246089372,0.430216944,0,0,3.691358025,5.175507315,IL1B
negative regulation of G protein-coupled receptor signaling pathway (GO:0045744),23-Jan,0.246089372,0.430216944,0,0,3.691358025,5.175507315,MET
negative regulation of GTPase activity (GO:0034260),23-Jan,0.246089372,0.430216944,0,0,3.691358025,5.175507315,RRP1B
negative regulation of phosphoprotein phosphatase activity (GO:0032515),23-Jan,0.246089372,0.430216944,0,0,3.691358025,5.175507315,TIPRL
negative regulation of signal transduction in absence of ligand (GO:1901099),23-Jan,0.246089372,0.430216944,0,0,3.691358025,5.175507315,IL1B
"nucleotide-excision repair, DNA damage recognition (GO:0000715)",23-Jan,0.246089372,0.430216944,0,0,3.691358025,5.175507315,COPS5
regulation of mononuclear cell migration (GO:0071675),23-Jan,0.246089372,0.430216944,0,0,3.691358025,5.175507315,CSF1
regulation of protein export from nucleus (GO:0046825),23-Jan,0.246089372,0.430216944,0,0,3.691358025,5.175507315,IL1B
regulation of release of sequestered calcium ion into cytosol by sarcoplasmic reticulum (GO:0010880),23-Jan,0.246089372,0.430216944,0,0,3.691358025,5.175507315,GSTO1
regulation of supramolecular fiber organization (GO:1902903),23-Jan,0.246089372,0.430216944,0,0,3.691358025,5.175507315,AEBP1
glucose 6-phosphate metabolic process (GO:0051156),23-Jan,0.246089372,0.430216944,0,0,3.691358025,5.175507315,HK2
positive regulation of interleukin-17 production (GO:0032740),23-Jan,0.246089372,0.430216944,0,0,3.691358025,5.175507315,PHB
positive regulation of JUN kinase activity (GO:0043507),23-Jan,0.246089372,0.430216944,0,0,3.691358025,5.175507315,PAK1
positive regulation of transcription initiation from RNA polymerase II promoter (GO:0060261),23-Jan,0.246089372,0.430216944,0,0,3.691358025,5.175507315,MED4
negative regulation of protein serine/threonine kinase activity (GO:0071901),2/78,0.246283613,0.430216944,0,0,2.140060896,2.998806363,IL1B;PRKAR2A
recombinational repair (GO:0000725),2/79,0.250803529,0.434511812,0,0,2.112160567,2.92129844,PSMD14;LIG3
organelle organization (GO:0006996),7/420,0.253924408,0.434511812,0,0,1.383322606,1.896146111,NSFL1C;SEC23IP;HAX1;SURF4;MICAL2;WDR73;PHB
regulation of cardiac muscle hypertrophy (GO:0010611),24-Jan,0.255297657,0.434511812,0,0,3.530685275,4.820533337,MTPN
negative regulation of lipid metabolic process (GO:0045833),24-Jan,0.255297657,0.434511812,0,0,3.530685275,4.820533337,IL1B
regulation of cell size (GO:0008361),24-Jan,0.255297657,0.434511812,0,0,3.530685275,4.820533337,MTPN
canonical glycolysis (GO:0061621),24-Jan,0.255297657,0.434511812,0,0,3.530685275,4.820533337,HK2
negative regulation of stress fiber assembly (GO:0051497),24-Jan,0.255297657,0.434511812,0,0,3.530685275,4.820533337,MET
negative regulation of synaptic transmission (GO:0050805),24-Jan,0.255297657,0.434511812,0,0,3.530685275,4.820533337,IL1B
defense response to fungus (GO:0050832),24-Jan,0.255297657,0.434511812,0,0,3.530685275,4.820533337,S100A8
regulation of monooxygenase activity (GO:0032768),24-Jan,0.255297657,0.434511812,0,0,3.530685275,4.820533337,IL1B
DNA packaging (GO:0006323),24-Jan,0.255297657,0.434511812,0,0,3.530685275,4.820533337,NOC2L
establishment of mitotic spindle orientation (GO:0000132),24-Jan,0.255297657,0.434511812,0,0,3.530685275,4.820533337,NSFL1C
regulation of ruffle assembly (GO:1900027),24-Jan,0.255297657,0.434511812,0,0,3.530685275,4.820533337,FAM98A
glucose catabolic process to pyruvate (GO:0061718),24-Jan,0.255297657,0.434511812,0,0,3.530685275,4.820533337,HK2
regulation of vascular endothelial growth factor receptor signaling pathway (GO:0030947),24-Jan,0.255297657,0.434511812,0,0,3.530685275,4.820533337,IL1B
positive regulation of p38MAPK cascade (GO:1900745),24-Jan,0.255297657,0.434511812,0,0,3.530685275,4.820533337,IL1B
positive regulation of viral life cycle (GO:1903902),24-Jan,0.255297657,0.434511812,0,0,3.530685275,4.820533337,P4HB
protein kinase B signaling (GO:0043491),24-Jan,0.255297657,0.434511812,0,0,3.530685275,4.820533337,IL1B
ncRNA 3'-end processing (GO:0043628),24-Jan,0.255297657,0.434511812,0,0,3.530685275,4.820533337,ERI1
negative regulation of extrinsic apoptotic signaling pathway (GO:2001237),2/80,0.255325781,0.434511812,0,0,2.08497563,2.846439955,IL1B;PSME3
regulation of NIK/NF-kappaB signaling (GO:1901222),2/80,0.255325781,0.434511812,0,0,2.08497563,2.846439955,IL1B;PHB
regulation of organelle organization (GO:0033043),2/80,0.255325781,0.434511812,0,0,2.08497563,2.846439955,SURF4;S100A8
regulation of protein localization to plasma membrane (GO:1903076),2/80,0.255325781,0.434511812,0,0,2.08497563,2.846439955,ZDHHC5;RANGRF
negative regulation of cellular process (GO:0048523),9/566,0.255692797,0.434649122,0,0,1.320073341,1.80028773,SMYD5;ACTN1;IL1B;PINX1;ARHGDIG;SMYD2;HMGA1;UTP20;PHB
ephrin receptor signaling pathway (GO:0048013),2/82,0.264374404,0.441529134,0,0,2.032644628,2.70420802,PAK1;ARPC1B
protein quality control for misfolded or incompletely synthesized proteins (GO:0006515),25-Jan,0.264393928,0.441529134,0,0,3.38340192,4.50099079,CLPP
acylglycerol homeostasis (GO:0055090),25-Jan,0.264393928,0.441529134,0,0,3.38340192,4.50099079,ANGPTL4
negative regulation of cell junction assembly (GO:1901889),25-Jan,0.264393928,0.441529134,0,0,3.38340192,4.50099079,IL1B
regulation of cAMP-mediated signaling (GO:0043949),25-Jan,0.264393928,0.441529134,0,0,3.38340192,4.50099079,PRKAR2A
regulation of cardiac muscle cell action potential (GO:0098901),25-Jan,0.264393928,0.441529134,0,0,3.38340192,4.50099079,RANGRF
cardiac conduction system development (GO:0003161),25-Jan,0.264393928,0.441529134,0,0,3.38340192,4.50099079,SCN5A
regulation of cholesterol transport (GO:0032374),25-Jan,0.264393928,0.441529134,0,0,3.38340192,4.50099079,NUS1
negative regulation of signaling (GO:0023057),25-Jan,0.264393928,0.441529134,0,0,3.38340192,4.50099079,IL1B
phosphatidylglycerol metabolic process (GO:0046471),25-Jan,0.264393928,0.441529134,0,0,3.38340192,4.50099079,LPGAT1
regulation of ryanodine-sensitive calcium-release channel activity (GO:0060314),25-Jan,0.264393928,0.441529134,0,0,3.38340192,4.50099079,GSTO1
positive regulation of ERBB signaling pathway (GO:1901186),25-Jan,0.264393928,0.441529134,0,0,3.38340192,4.50099079,PLAUR
response to hexose (GO:0009746),25-Jan,0.264393928,0.441529134,0,0,3.38340192,4.50099079,EIF2B5
positive regulation of lipid metabolic process (GO:0045834),25-Jan,0.264393928,0.441529134,0,0,3.38340192,4.50099079,IL1B
positive regulation of release of cytochrome c from mitochondria (GO:0090200),25-Jan,0.264393928,0.441529134,0,0,3.38340192,4.50099079,PLAUR
positive regulation of vascular endothelial growth factor production (GO:0010575),25-Jan,0.264393928,0.441529134,0,0,3.38340192,4.50099079,IL1B
positive regulation of protein modification process (GO:0031401),4/214,0.265347463,0.442634559,0,0,1.551269841,2.058093171,PAK1;IL1B;PLAUR;CAMKK2
extracellular structure organization (GO:0043062),4/216,0.270728337,0.449199955,0,0,1.536477987,2.007622686,ADAM12;TNC;ITGA7;CD44
negative regulation of cell development (GO:0010721),26-Jan,0.273379541,0.449199955,0,0,3.247901235,4.212184244,IL1B
purine-containing compound biosynthetic process (GO:0072522),26-Jan,0.273379541,0.449199955,0,0,3.247901235,4.212184244,PRPS1
negative regulation of intrinsic apoptotic signaling pathway in response to DNA damage (GO:1902230),26-Jan,0.273379541,0.449199955,0,0,3.247901235,4.212184244,CD44
cellular response to drug (GO:0035690),26-Jan,0.273379541,0.449199955,0,0,3.247901235,4.212184244,IL1B
negative regulation of telomere maintenance via telomere lengthening (GO:1904357),26-Jan,0.273379541,0.449199955,0,0,3.247901235,4.212184244,PINX1
negative regulation of transposition (GO:0010529),26-Jan,0.273379541,0.449199955,0,0,3.247901235,4.212184244,SMYD5
endothelial cell development (GO:0001885),26-Jan,0.273379541,0.449199955,0,0,3.247901235,4.212184244,MET
glial cell development (GO:0021782),26-Jan,0.273379541,0.449199955,0,0,3.247901235,4.212184244,EIF2B5
hippo signaling (GO:0035329),26-Jan,0.273379541,0.449199955,0,0,3.247901235,4.212184244,MOB1A
positive regulation of interleukin-2 production (GO:0032743),26-Jan,0.273379541,0.449199955,0,0,3.247901235,4.212184244,IL1B
membrane depolarization during action potential (GO:0086010),26-Jan,0.273379541,0.449199955,0,0,3.247901235,4.212184244,SCN5A
TOR signaling (GO:0031929),26-Jan,0.273379541,0.449199955,0,0,3.247901235,4.212184244,TIPRL
external encapsulating structure organization (GO:0045229),4/217,0.27342606,0.449199955,0,0,1.529186228,1.982932548,ADAM12;TNC;ITGA7;CD44
"retrograde vesicle-mediated transport, Golgi to endoplasmic reticulum (GO:0006890)",2/85,0.277947247,0.456133969,0,0,1.95887683,2.507996904,ARF3;SURF4
negative regulation of catalytic activity (GO:0043086),27-Jan,0.282255836,0.457617623,0,0,3.122823678,3.950188955,TIMP1
negative regulation of cation channel activity (GO:2001258),27-Jan,0.282255836,0.457617623,0,0,3.122823678,3.950188955,GSTO1
negative regulation of insulin receptor signaling pathway (GO:0046627),27-Jan,0.282255836,0.457617623,0,0,3.122823678,3.950188955,IL1B
chondroitin sulfate proteoglycan biosynthetic process (GO:0050650),27-Jan,0.282255836,0.457617623,0,0,3.122823678,3.950188955,CHPF
peptidyl-lysine methylation (GO:0018022),27-Jan,0.282255836,0.457617623,0,0,3.122823678,3.950188955,SMYD2
regulation of vascular endothelial growth factor production (GO:0010574),27-Jan,0.282255836,0.457617623,0,0,3.122823678,3.950188955,IL1B
positive regulation of nitric oxide biosynthetic process (GO:0045429),27-Jan,0.282255836,0.457617623,0,0,3.122823678,3.950188955,IL1B
positive regulation of nuclear division (GO:0051785),27-Jan,0.282255836,0.457617623,0,0,3.122823678,3.950188955,IL1B
protein export from nucleus (GO:0006611),27-Jan,0.282255836,0.457617623,0,0,3.122823678,3.950188955,XPO5
negative regulation of actin filament bundle assembly (GO:0032232),27-Jan,0.282255836,0.457617623,0,0,3.122823678,3.950188955,MET
regulation of neuron death (GO:1901214),2/86,0.282468849,0.457617623,0,0,1.935458481,2.446781456,CSF1;SIGMAR1
positive regulation of endothelial cell migration (GO:0010595),2/86,0.282468849,0.457617623,0,0,1.935458481,2.446781456,NUS1;MET
actin filament organization (GO:0007015),3/152,0.283575738,0.458921078,0,0,1.638057312,2.064404377,TPM4;ACTN1;FLNA
positive regulation of Wnt signaling pathway (GO:0030177),3/153,0.286892594,0.460661775,0,0,1.627053942,2.031616626,PSMD14;PSME3;PSMD3
calcium ion transmembrane transport (GO:0070588),2/87,0.286988052,0.460661775,0,0,1.912591152,2.387515637,PMPCA;PHB
positive regulation of protein kinase activity (GO:0045860),3/154,0.290212572,0.460661775,0,0,1.616196312,1.999463722,PAK1;CSF1;HMGA2
negative regulation of calcium ion transmembrane transporter activity (GO:1901020),28-Jan,0.291024139,0.460661775,0,0,3.007011126,3.711701372,GSTO1
negative regulation of cellular response to insulin stimulus (GO:1900077),28-Jan,0.291024139,0.460661775,0,0,3.007011126,3.711701372,IL1B
receptor clustering (GO:0043113),28-Jan,0.291024139,0.460661775,0,0,3.007011126,3.711701372,FLNA
negative regulation of phosphatase activity (GO:0010923),28-Jan,0.291024139,0.460661775,0,0,3.007011126,3.711701372,TIPRL
cellular response to epidermal growth factor stimulus (GO:0071364),28-Jan,0.291024139,0.460661775,0,0,3.007011126,3.711701372,PTPN12
regulation of extrinsic apoptotic signaling pathway in absence of ligand (GO:2001239),28-Jan,0.291024139,0.460661775,0,0,3.007011126,3.711701372,IL1B
cellular response to interleukin-6 (GO:0071354),28-Jan,0.291024139,0.460661775,0,0,3.007011126,3.711701372,PHB
regulation of immunoglobulin production (GO:0002637),28-Jan,0.291024139,0.460661775,0,0,3.007011126,3.711701372,PHB
cristae formation (GO:0042407),28-Jan,0.291024139,0.460661775,0,0,3.007011126,3.711701372,DNAJC11
regulation of phosphatase activity (GO:0010921),28-Jan,0.291024139,0.460661775,0,0,3.007011126,3.711701372,TIPRL
regulation of plasma membrane bounded cell projection organization (GO:0120035),28-Jan,0.291024139,0.460661775,0,0,3.007011126,3.711701372,NCS1
histone mRNA metabolic process (GO:0008334),28-Jan,0.291024139,0.460661775,0,0,3.007011126,3.711701372,ERI1
internal peptidyl-lysine acetylation (GO:0018393),28-Jan,0.291024139,0.460661775,0,0,3.007011126,3.711701372,RUVBL2
positive regulation of nitric oxide metabolic process (GO:1904407),28-Jan,0.291024139,0.460661775,0,0,3.007011126,3.711701372,IL1B
L-amino acid transport (GO:0015807),28-Jan,0.291024139,0.460661775,0,0,3.007011126,3.711701372,SFXN1
positive regulation of protein import into nucleus (GO:0042307),28-Jan,0.291024139,0.460661775,0,0,3.007011126,3.711701372,FLNA
protein depolymerization (GO:0051261),28-Jan,0.291024139,0.460661775,0,0,3.007011126,3.711701372,MICAL2
protein localization to lysosome (GO:0061462),28-Jan,0.291024139,0.460661775,0,0,3.007011126,3.711701372,M6PR
negative regulation of binding (GO:0051100),2/88,0.291504245,0.460941087,0,0,1.890255622,2.33011945,HMGA2;GTF2F1
positive regulation of inflammatory response (GO:0050729),2/89,0.296016829,0.467415255,0,0,1.868433552,2.274516978,IL1B;S100A8
regulation of cell differentiation (GO:0045595),3/156,0.296860757,0.467415255,0,0,1.594906842,1.93700173,CSF1;SMYD5;NSUN2
regulation of actin polymerization or depolymerization (GO:0008064),29-Jan,0.299685757,0.467415255,0,0,2.899470899,3.49392283,HAX1
regulation of DNA biosynthetic process (GO:2000278),29-Jan,0.299685757,0.467415255,0,0,2.899470899,3.49392283,PINX1
regulation of double-strand break repair via nonhomologous end joining (GO:2001032),29-Jan,0.299685757,0.467415255,0,0,2.899470899,3.49392283,HMGA2
regulation of fatty acid biosynthetic process (GO:0042304),29-Jan,0.299685757,0.467415255,0,0,2.899470899,3.49392283,LPGAT1
negative regulation of transferase activity (GO:0051348),29-Jan,0.299685757,0.467415255,0,0,2.899470899,3.49392283,PINX1
regulation of response to biotic stimulus (GO:0002831),29-Jan,0.299685757,0.467415255,0,0,2.899470899,3.49392283,TRAF3
establishment of mitotic spindle localization (GO:0040001),29-Jan,0.299685757,0.467415255,0,0,2.899470899,3.49392283,NSFL1C
glial cell differentiation (GO:0010001),29-Jan,0.299685757,0.467415255,0,0,2.899470899,3.49392283,EIF2B5
glycolytic process (GO:0006096),29-Jan,0.299685757,0.467415255,0,0,2.899470899,3.49392283,HK2
positive regulation of leukocyte migration (GO:0002687),29-Jan,0.299685757,0.467415255,0,0,2.899470899,3.49392283,CSF1
mismatch repair (GO:0006298),29-Jan,0.299685757,0.467415255,0,0,2.899470899,3.49392283,POLD2
negative regulation of translation (GO:0017148),2/90,0.300525223,0.467415255,0,0,1.847107438,2.220636138,METTL16;PUS7
mitochondrial respiratory chain complex assembly (GO:0033108),2/90,0.300525223,0.467415255,0,0,1.847107438,2.220636138,CHCHD4;NDUFAF4
protein complex oligomerization (GO:0051259),2/90,0.300525223,0.467415255,0,0,1.847107438,2.220636138,EHD1;ZNHIT6
cellular response to growth factor stimulus (GO:0071363),3/158,0.303518051,0.470623496,0,0,1.574166778,1.876901391,EHD1;PTPN12;CD44
cellular response to starvation (GO:0009267),3/158,0.303518051,0.470623496,0,0,1.574166778,1.876901391,MYBBP1A;ITFG2;RRP8
organonitrogen compound biosynthetic process (GO:1901566),3/158,0.303518051,0.470623496,0,0,1.574166778,1.876901391,SLC25A15;PRKD3;GSTO1
toll-like receptor signaling pathway (GO:0002224),2/91,0.305028859,0.470735746,0,0,1.826260563,2.168408444,TRAF3;S100A8
positive regulation of supramolecular fiber organization (GO:1902905),2/91,0.305028859,0.470735746,0,0,1.826260563,2.168408444,PAK1;MET
protein autophosphorylation (GO:0046777),3/159,0.306849426,0.470735746,0,0,1.56399617,1.847702134,PAK1;PEAK1;CAMKK2
cardiac muscle cell action potential (GO:0086001),30-Jan,0.308241984,0.470735746,0,0,2.79934724,3.294468185,SCN5A
chondroitin sulfate metabolic process (GO:0030204),30-Jan,0.308241984,0.470735746,0,0,2.79934724,3.294468185,CHPF
peptidyl-lysine trimethylation (GO:0018023),30-Jan,0.308241984,0.470735746,0,0,2.79934724,3.294468185,SMYD5
establishment of spindle orientation (GO:0051294),30-Jan,0.308241984,0.470735746,0,0,2.79934724,3.294468185,NSFL1C
positive regulation of endopeptidase activity (GO:0010950),30-Jan,0.308241984,0.470735746,0,0,2.79934724,3.294468185,PSME3
heterotypic cell-cell adhesion (GO:0034113),30-Jan,0.308241984,0.470735746,0,0,2.79934724,3.294468185,ITGA7
ion homeostasis (GO:0050801),30-Jan,0.308241984,0.470735746,0,0,2.79934724,3.294468185,RANGRF
snRNA 3'-end processing (GO:0034472),30-Jan,0.308241984,0.470735746,0,0,2.79934724,3.294468185,EXOSC9
positive regulation of protein import (GO:1904591),30-Jan,0.308241984,0.470735746,0,0,2.79934724,3.294468185,FLNA
positive regulation of small GTPase mediated signal transduction (GO:0051057),30-Jan,0.308241984,0.470735746,0,0,2.79934724,3.294468185,LRRC59
TRIF-dependent toll-like receptor signaling pathway (GO:0035666),30-Jan,0.308241984,0.470735746,0,0,2.79934724,3.294468185,TRAF3
ncRNA catabolic process (GO:0034661),30-Jan,0.308241984,0.470735746,0,0,2.79934724,3.294468185,EXOSC9
regulation of peptidyl-tyrosine phosphorylation (GO:0050730),2/92,0.309527185,0.472223384,0,0,1.805876951,2.117768797,HAX1;CD44
positive regulation of protein kinase B signaling (GO:0051897),3/161,0.313516282,0.476926229,0,0,1.544041179,1.790939513,HAX1;PHB;MET
regulation of epithelial cell proliferation (GO:0050678),2/93,0.31401966,0.476926229,0,0,1.785941331,2.068655278,NME2;SCN5A
'de novo' posttranslational protein folding (GO:0051084),31-Jan,0.316694096,0.476926229,0,0,2.705898491,3.111293406,CHCHD4
protein palmitoylation (GO:0018345),31-Jan,0.316694096,0.476926229,0,0,2.705898491,3.111293406,ZDHHC5
negative regulation of DNA binding (GO:0043392),31-Jan,0.316694096,0.476926229,0,0,2.705898491,3.111293406,HMGA2
regulation of cellular component size (GO:0032535),31-Jan,0.316694096,0.476926229,0,0,2.705898491,3.111293406,MTPN
cardiac muscle cell action potential involved in contraction (GO:0086002),31-Jan,0.316694096,0.476926229,0,0,2.705898491,3.111293406,SCN5A
negative regulation of response to DNA damage stimulus (GO:2001021),31-Jan,0.316694096,0.476926229,0,0,2.705898491,3.111293406,CD44
regulation of macrophage derived foam cell differentiation (GO:0010743),31-Jan,0.316694096,0.476926229,0,0,2.705898491,3.111293406,CSF1
renal water homeostasis (GO:0003091),31-Jan,0.316694096,0.476926229,0,0,2.705898491,3.111293406,PRKAR2A
positive regulation of leukocyte cell-cell adhesion (GO:1903039),31-Jan,0.316694096,0.476926229,0,0,2.705898491,3.111293406,CD44
triglyceride homeostasis (GO:0070328),31-Jan,0.316694096,0.476926229,0,0,2.705898491,3.111293406,ANGPTL4
MyD88-independent toll-like receptor signaling pathway (GO:0002756),31-Jan,0.316694096,0.476926229,0,0,2.705898491,3.111293406,TRAF3
negative regulation of cellular protein metabolic process (GO:0032269),2/94,0.31850576,0.478231201,0,0,1.766439095,2.021008967,DNAJC1;PUS7
negative regulation of MAPK cascade (GO:0043409),2/94,0.31850576,0.478231201,0,0,1.766439095,2.021008967,IL1B;PHB
regulation of kinase activity (GO:0043549),2/94,0.31850576,0.478231201,0,0,1.766439095,2.021008967,MET;CAMKK2
mRNA metabolic process (GO:0016071),2/95,0.322984974,0.480912101,0,0,1.747356261,1.974773766,PRPF3;METTL16
