Term,Overlap,P-value,Adjusted P-value,Old P-value,Old Adjusted P-value,Odds Ratio,Combined Score,Genes
activation of phospholipase C activity (GO:0007202),1/32,0.325043356,0.480912101,0,0,2.618478694,2.942637718,PHB
negative regulation of DNA biosynthetic process (GO:2000279),1/32,0.325043356,0.480912101,0,0,2.618478694,2.942637718,PINX1
aortic valve morphogenesis (GO:0003180),1/32,0.325043356,0.480912101,0,0,2.618478694,2.942637718,NFATC1
negative regulation of double-strand break repair (GO:2000780),1/32,0.325043356,0.480912101,0,0,2.618478694,2.942637718,HMGA2
negative regulation of intracellular steroid hormone receptor signaling pathway (GO:0033144),1/32,0.325043356,0.480912101,0,0,2.618478694,2.942637718,PHB
regulation of cell morphogenesis (GO:0022604),1/32,0.325043356,0.480912101,0,0,2.618478694,2.942637718,CD44
regulation of intracellular estrogen receptor signaling pathway (GO:0033146),1/32,0.325043356,0.480912101,0,0,2.618478694,2.942637718,PAK1
chondrocyte differentiation (GO:0002062),1/32,0.325043356,0.480912101,0,0,2.618478694,2.942637718,HMGA2
DNA damage checkpoint signaling (GO:0000077),1/32,0.325043356,0.480912101,0,0,2.618478694,2.942637718,TIPRL
ERBB2 signaling pathway (GO:0038128),1/32,0.325043356,0.480912101,0,0,2.618478694,2.942637718,PTPN12
gene silencing by miRNA (GO:0035195),1/32,0.325043356,0.480912101,0,0,2.618478694,2.942637718,XPO5
membrane depolarization (GO:0051899),1/32,0.325043356,0.480912101,0,0,2.618478694,2.942637718,SCN5A
mitochondrial membrane organization (GO:0007006),1/32,0.325043356,0.480912101,0,0,2.618478694,2.942637718,DNAJC11
protein K63-linked deubiquitination (GO:0070536),1/32,0.325043356,0.480912101,0,0,2.618478694,2.942637718,PSMD14
regulation of MAPK cascade (GO:0043408),3/166,0.330195133,0.488058629,0,0,1.496296108,1.658003052,PAK1;DHX33;IL1B
double-strand break repair via homologous recombination (GO:0000724),2/97,0.331920759,0.488354975,0,0,1.710395824,1.886325456,PSMD14;LIG3
glycosaminoglycan biosynthetic process (GO:0006024),2/97,0.331920759,0.488354975,0,0,1.710395824,1.886325456,CHPF;IL1B
apoptotic mitochondrial changes (GO:0008637),1/33,0.33329101,0.488354975,0,0,2.536522634,2.786977016,HK2
regulation of interleukin-17 production (GO:0032660),1/33,0.33329101,0.488354975,0,0,2.536522634,2.786977016,PHB
regulation of protein localization to cell surface (GO:2000008),1/33,0.33329101,0.488354975,0,0,2.536522634,2.786977016,RANGRF
exonucleolytic catabolism of deadenylated mRNA (GO:0043928),1/33,0.33329101,0.488354975,0,0,2.536522634,2.786977016,EXOSC9
RNA stabilization (GO:0043489),1/33,0.33329101,0.488354975,0,0,2.536522634,2.786977016,NSUN2
positive regulation of organelle organization (GO:0010638),1/33,0.33329101,0.488354975,0,0,2.536522634,2.786977016,SURF4
mitotic G2 DNA damage checkpoint signaling (GO:0007095),1/33,0.33329101,0.488354975,0,0,2.536522634,2.786977016,HMGA2
protein polyubiquitination (GO:0000209),5/314,0.337654559,0.494092778,0,0,1.316637554,1.429515422,PSMD14;TRAF3;PSME3;PSMD3;FBXO17
response to UV (GO:0009411),2/99,0.340823185,0.494092778,0,0,1.67495953,1.802912125,RUVBL2;NOC2L
positive regulation of stress-activated MAPK cascade (GO:0032874),2/99,0.340823185,0.494092778,0,0,1.67495953,1.802912125,TRAF3;IL1B
regulation of amyloid-beta formation (GO:1902003),1/34,0.34143829,0.494092778,0,0,2.459533608,2.642986087,GSAP
cardiac muscle contraction (GO:0060048),1/34,0.34143829,0.494092778,0,0,2.459533608,2.642986087,SCN5A
cellular response to vascular endothelial growth factor stimulus (GO:0035924),1/34,0.34143829,0.494092778,0,0,2.459533608,2.642986087,NUS1
regulation of keratinocyte differentiation (GO:0045616),1/34,0.34143829,0.494092778,0,0,2.459533608,2.642986087,NME2
positive regulation of epidermal growth factor receptor signaling pathway (GO:0045742),1/34,0.34143829,0.494092778,0,0,2.459533608,2.642986087,PLAUR
histone lysine methylation (GO:0034968),1/34,0.34143829,0.494092778,0,0,2.459533608,2.642986087,SMYD2
positive regulation of pri-miRNA transcription by RNA polymerase II (GO:1902895),1/34,0.34143829,0.494092778,0,0,2.459533608,2.642986087,FOSL1
positive regulation of release of sequestered calcium ion into cytosol (GO:0051281),1/34,0.34143829,0.494092778,0,0,2.459533608,2.642986087,GSTO1
tRNA methylation (GO:0030488),1/34,0.34143829,0.494092778,0,0,2.459533608,2.642986087,NSUN2
protein localization to chromosome (GO:0034502),1/34,0.34143829,0.494092778,0,0,2.459533608,2.642986087,PINX1
negative regulation of neurogenesis (GO:0050768),1/35,0.349486411,0.498897866,0,0,2.387073348,2.509507771,IL1B
negative regulation of Ras protein signal transduction (GO:0046580),1/35,0.349486411,0.498897866,0,0,2.387073348,2.509507771,MET
cellular response to hydrogen peroxide (GO:0070301),1/35,0.349486411,0.498897866,0,0,2.387073348,2.509507771,SIGMAR1
cellular response to virus (GO:0098586),1/35,0.349486411,0.498897866,0,0,2.387073348,2.509507771,RRP1B
regulation of JUN kinase activity (GO:0043506),1/35,0.349486411,0.498897866,0,0,2.387073348,2.509507771,PAK1
"nuclear-transcribed mRNA catabolic process, exonucleolytic (GO:0000291)",1/35,0.349486411,0.498897866,0,0,2.387073348,2.509507771,EXOSC9
oxoacid metabolic process (GO:0043436),1/35,0.349486411,0.498897866,0,0,2.387073348,2.509507771,PPA1
peptidyl-tyrosine dephosphorylation (GO:0035335),1/35,0.349486411,0.498897866,0,0,2.387073348,2.509507771,PTPN12
regulation of protein polymerization (GO:0032271),1/35,0.349486411,0.498897866,0,0,2.387073348,2.509507771,HAX1
regulation of TORC1 signaling (GO:1903432),1/35,0.349486411,0.498897866,0,0,2.387073348,2.509507771,ITFG2
response to estrogen (GO:0043627),1/35,0.349486411,0.498897866,0,0,2.387073348,2.509507771,PELP1
positive regulation of immunoglobulin production (GO:0002639),1/35,0.349486411,0.498897866,0,0,2.387073348,2.509507771,PHB
positive regulation of lipid biosynthetic process (GO:0046889),1/35,0.349486411,0.498897866,0,0,2.387073348,2.509507771,LPGAT1
protein localization to cilium (GO:0061512),1/35,0.349486411,0.498897866,0,0,2.387073348,2.509507771,EHD1
positive regulation of protein localization to membrane (GO:1905477),2/101,0.349688623,0.498897866,0,0,1.640955005,1.724171394,ZDHHC5;RANGRF
regulation of protein catabolic process (GO:0042176),2/102,0.35410639,0.501005284,0,0,1.62446281,1.686448859,FLNA;PHB
intrinsic apoptotic signaling pathway (GO:0097193),2/102,0.35410639,0.501005284,0,0,1.62446281,1.686448859,MYBBP1A;RRP8
proteasome-mediated ubiquitin-dependent protein catabolic process (GO:0043161),5/321,0.354534449,0.501005284,0,0,1.287008103,1.334562745,NSFL1C;PSMD14;PSME3;PSMD3;FBXO17
negative regulation of cellular protein localization (GO:1903828),1/36,0.357436576,0.501005284,0,0,2.318753674,2.385527617,NSFL1C
aortic valve development (GO:0003176),1/36,0.357436576,0.501005284,0,0,2.318753674,2.385527617,NFATC1
regulation of androgen receptor signaling pathway (GO:0060765),1/36,0.357436576,0.501005284,0,0,2.318753674,2.385527617,PHB
regulation of cardiac muscle contraction (GO:0055117),1/36,0.357436576,0.501005284,0,0,2.318753674,2.385527617,SCN5A
regulation of cell cycle G1/S phase transition (GO:1902806),1/36,0.357436576,0.501005284,0,0,2.318753674,2.385527617,PSME3
regulation of mRNA processing (GO:0050684),1/36,0.357436576,0.501005284,0,0,2.318753674,2.385527617,METTL16
regulation of osteoclast differentiation (GO:0045670),1/36,0.357436576,0.501005284,0,0,2.318753674,2.385527617,CSF1
regulation of protein import into nucleus (GO:0042306),1/36,0.357436576,0.501005284,0,0,2.318753674,2.385527617,FLNA
positive regulation of cytokine-mediated signaling pathway (GO:0001961),1/36,0.357436576,0.501005284,0,0,2.318753674,2.385527617,CSF1
positive regulation of innate immune response (GO:0045089),1/36,0.357436576,0.501005284,0,0,2.318753674,2.385527617,POLR3G
positive regulation of interferon-beta production (GO:0032728),1/36,0.357436576,0.501005284,0,0,2.318753674,2.385527617,POLR3G
positive regulation of mitotic nuclear division (GO:0045840),1/36,0.357436576,0.501005284,0,0,2.318753674,2.385527617,IL1B
membrane assembly (GO:0071709),1/36,0.357436576,0.501005284,0,0,2.318753674,2.385527617,NSFL1C
membrane fusion (GO:0061025),1/36,0.357436576,0.501005284,0,0,2.318753674,2.385527617,NSFL1C
positive regulation of T cell mediated immunity (GO:0002711),1/36,0.357436576,0.501005284,0,0,2.318753674,2.385527617,IL1B
"Wnt signaling pathway, calcium modulating pathway (GO:0007223)",1/36,0.357436576,0.501005284,0,0,2.318753674,2.385527617,NFATC1
regulation of actin cytoskeleton reorganization (GO:2000249),1/37,0.365289972,0.507328617,0,0,2.254229538,2.270152955,HAX1
"nucleotide-excision repair, DNA incision, 5'-to lesion (GO:0006296)",1/37,0.365289972,0.507328617,0,0,2.254229538,2.270152955,POLD2
regulation of p38MAPK cascade (GO:1900744),1/37,0.365289972,0.507328617,0,0,2.254229538,2.270152955,IL1B
phospholipid biosynthetic process (GO:0008654),1/37,0.365289972,0.507328617,0,0,2.254229538,2.270152955,NUS1
positive regulation of cytokinesis (GO:0032467),1/37,0.365289972,0.507328617,0,0,2.254229538,2.270152955,CSPP1
regulation of transport (GO:0051049),1/37,0.365289972,0.507328617,0,0,2.254229538,2.270152955,GAPVD1
glutamine family amino acid metabolic process (GO:0009064),1/37,0.365289972,0.507328617,0,0,2.254229538,2.270152955,ALDH18A1
lysosome localization (GO:0032418),1/37,0.365289972,0.507328617,0,0,2.254229538,2.270152955,FAM98A
protein insertion into ER membrane (GO:0045048),1/37,0.365289972,0.507328617,0,0,2.254229538,2.270152955,EMC6
ncRNA metabolic process (GO:0034660),1/37,0.365289972,0.507328617,0,0,2.254229538,2.270152955,XPO5
positive regulation of signal transduction (GO:0009967),4/252,0.36961672,0.510168036,0,0,1.311021505,1.304844894,IL1B;ZDHHC5;FLNA;PHB
cellular protein modification process (GO:0006464),14/1025,0.370868254,0.510168036,0,0,1.128585559,1.119453484,NUS1;CSF1;PSMD14;FBXO17;TNC;PTPN12;CAMKK2;PAK1;COPS5;PEAK1;PSME3;PSMD3;TIMP1;P4HB
regulation of cell cycle process (GO:0010564),2/106,0.371668304,0.510168036,0,0,1.561665607,1.545663967,PRMT5;HMGA2
chromosome organization (GO:0051276),2/106,0.371668304,0.510168036,0,0,1.561665607,1.545663967,COPS5;HMGA2
RNA export from nucleus (GO:0006405),2/106,0.371668304,0.510168036,0,0,1.561665607,1.545663967,XPO5;AGFG1
positive regulation of protein serine/threonine kinase activity (GO:0071902),2/106,0.371668304,0.510168036,0,0,1.561665607,1.545663967,IL1B;HMGA2
neutrophil degranulation (GO:0043312),7/481,0.372111436,0.510168036,0,0,1.201499048,1.187756193,PSMD14;PSMD3;SURF4;NME2;PLAUR;CD44;S100A8
regulation of canonical Wnt signaling pathway (GO:0060828),4/253,0.372381766,0.510168036,0,0,1.305689424,1.289806623,PSMD14;PSME3;RUVBL2;PSMD3
actin-myosin filament sliding (GO:0033275),1/38,0.373047773,0.510168036,0,0,2.193193193,2.162595493,TPM4
negative regulation of TOR signaling (GO:0032007),1/38,0.373047773,0.510168036,0,0,2.193193193,2.162595493,ITFG2
connective tissue development (GO:0061448),1/38,0.373047773,0.510168036,0,0,2.193193193,2.162595493,CD44
regulation of phosphoprotein phosphatase activity (GO:0043666),1/38,0.373047773,0.510168036,0,0,2.193193193,2.162595493,TIPRL
response to estradiol (GO:0032355),1/38,0.373047773,0.510168036,0,0,2.193193193,2.162595493,RUVBL2
positive regulation of potassium ion transport (GO:0043268),1/38,0.373047773,0.510168036,0,0,2.193193193,2.162595493,FLNA
positive regulation of production of molecular mediator of immune response (GO:0002702),1/38,0.373047773,0.510168036,0,0,2.193193193,2.162595493,PHB
mRNA destabilization (GO:0061157),1/38,0.373047773,0.510168036,0,0,2.193193193,2.162595493,METTL16
muscle filament sliding (GO:0030049),1/38,0.373047773,0.510168036,0,0,2.193193193,2.162595493,TPM4
cellular protein localization (GO:0034613),5/329,0.373870347,0.510692195,0,0,1.25471357,1.234445188,EHD1;ARF3;SEC23IP;USP4;FLNA
cellular response to cytokine stimulus (GO:0071345),7/482,0.374103901,0.510692195,0,0,1.198907395,1.17879178,HAX1;CSF1;IL1B;TIMP1;PHB;PTPN12;CXCL2
regulated exocytosis (GO:0045055),3/180,0.376756273,0.512339988,0,0,1.376960405,1.344129251,ACTN1;FLNA;TIMP1
positive regulation of cellular biosynthetic process (GO:0031328),3/180,0.376756273,0.512339988,0,0,1.376960405,1.344129251,LPGAT1;IL1B;NMD3
neutrophil activation involved in immune response (GO:0002283),7/485,0.38008478,0.512339988,0,0,1.1911975,1.152317941,PSMD14;PSMD3;SURF4;NME2;PLAUR;CD44;S100A8
DNA replication (GO:0006260),2/108,0.380378437,0.512339988,0,0,1.532044285,1.480856596,ORC2;POLD2
negative regulation of protein secretion (GO:0050709),1/39,0.380711137,0.512339988,0,0,2.135369287,2.062156788,IL1B
regulation of heart rate by cardiac conduction (GO:0086091),1/39,0.380711137,0.512339988,0,0,2.135369287,2.062156788,SCN5A
regulation of ion transmembrane transporter activity (GO:0032412),1/39,0.380711137,0.512339988,0,0,2.135369287,2.062156788,RANGRF
"nucleotide-excision repair, DNA incision (GO:0033683)",1/39,0.380711137,0.512339988,0,0,2.135369287,2.062156788,POLD2
odontogenesis (GO:0042476),1/39,0.380711137,0.512339988,0,0,2.135369287,2.062156788,SCN5A
DNA integrity checkpoint signaling (GO:0031570),1/39,0.380711137,0.512339988,0,0,2.135369287,2.062156788,TIPRL
regulation of protein targeting to mitochondrion (GO:1903214),1/39,0.380711137,0.512339988,0,0,2.135369287,2.062156788,HAX1
regulation of viral entry into host cell (GO:0046596),1/39,0.380711137,0.512339988,0,0,2.135369287,2.062156788,P4HB
response to peptide (GO:1901652),1/39,0.380711137,0.512339988,0,0,2.135369287,2.062156788,EIF2B5
positive regulation of intracellular transport (GO:0032388),1/39,0.380711137,0.512339988,0,0,2.135369287,2.062156788,EHD1
membrane protein proteolysis (GO:0033619),1/39,0.380711137,0.512339988,0,0,2.135369287,2.062156788,CLPP
protein acylation (GO:0043543),1/39,0.380711137,0.512339988,0,0,2.135369287,2.062156788,ZDHHC5
neutrophil mediated immunity (GO:0002446),7/488,0.386069778,0.517580191,0,0,1.183583779,1.126460655,PSMD14;PSMD3;SURF4;NME2;PLAUR;CD44;S100A8
negative regulation of blood coagulation (GO:0030195),1/40,0.388281209,0.517580191,0,0,2.08051071,1.96821605,PLAUR
negative regulation of ERBB signaling pathway (GO:1901185),1/40,0.388281209,0.517580191,0,0,2.08051071,1.96821605,PTPN12
carboxylic acid metabolic process (GO:0019752),1/40,0.388281209,0.517580191,0,0,2.08051071,1.96821605,GSTO1
nucleocytoplasmic transport (GO:0006913),1/40,0.388281209,0.517580191,0,0,2.08051071,1.96821605,SMN1
regulation of nitric oxide biosynthetic process (GO:0045428),1/40,0.388281209,0.517580191,0,0,2.08051071,1.96821605,IL1B
positive regulation of cation channel activity (GO:2001259),1/40,0.388281209,0.517580191,0,0,2.08051071,1.96821605,GSTO1
regulation of sodium ion transmembrane transporter activity (GO:2000649),1/40,0.388281209,0.517580191,0,0,2.08051071,1.96821605,RANGRF
positive regulation of intrinsic apoptotic signaling pathway (GO:2001244),1/40,0.388281209,0.517580191,0,0,2.08051071,1.96821605,S100A8
stem cell differentiation (GO:0048863),1/40,0.388281209,0.517580191,0,0,2.08051071,1.96821605,HMGA2
positive regulation of cytokine production (GO:0001819),5/335,0.388375785,0.517580191,0,0,1.231520223,1.164749525,DHX33;IL1B;POLR3G;PHB;DDX41
regulation of protein kinase activity (GO:0045859),2/110,0.389037548,0.517580191,0,0,1.503520049,1.419442329,CSF1;CAMKK2
response to endoplasmic reticulum stress (GO:0034976),2/110,0.389037548,0.517580191,0,0,1.503520049,1.419442329,EIF2B5;P4HB
cellular component assembly (GO:0022607),4/261,0.394461376,0.523312148,0,0,1.264526589,1.176305688,TSPAN4;FLNA;NOC2L;MDN1
regulation of cell development (GO:0060284),1/41,0.395759121,0.523312148,0,0,2.028395062,1.880219856,IL1B
carbohydrate catabolic process (GO:0016052),1/41,0.395759121,0.523312148,0,0,2.028395062,1.880219856,HK2
regulation of protein dephosphorylation (GO:0035304),1/41,0.395759121,0.523312148,0,0,2.028395062,1.880219856,TIPRL
regulation of release of cytochrome c from mitochondria (GO:0090199),1/41,0.395759121,0.523312148,0,0,2.028395062,1.880219856,PLAUR
positive regulation of cation transmembrane transport (GO:1904064),1/41,0.395759121,0.523312148,0,0,2.028395062,1.880219856,FLNA
heart contraction (GO:0060047),1/41,0.395759121,0.523312148,0,0,2.028395062,1.880219856,SCN5A
protein-containing complex subunit organization (GO:0043933),2/112,0.397642991,0.52443272,0,0,1.476033058,1.361198694,TSPAN4;MDN1
regulation of cytoskeleton organization (GO:0051493),2/112,0.397642991,0.52443272,0,0,1.476033058,1.361198694,PAK1;S100A8
phosphatidylinositol metabolic process (GO:0046488),2/112,0.397642991,0.52443272,0,0,1.476033058,1.361198694,ARF3;LPGAT1
regulation of mitotic cell cycle phase transition (GO:1901990),3/188,0.403093123,0.529390667,0,0,1.316877874,1.196498996,PSMD14;PSME3;PSMD3
nucleic acid-templated transcription (GO:0097659),1/42,0.403145989,0.529390667,0,0,1.97882164,1.797673434,PWP1
regulation of nervous system development (GO:0051960),1/42,0.403145989,0.529390667,0,0,1.97882164,1.797673434,IL1B
positive regulation of epithelial to mesenchymal transition (GO:0010718),1/42,0.403145989,0.529390667,0,0,1.97882164,1.797673434,IL1B
translesion synthesis (GO:0019985),1/42,0.403145989,0.529390667,0,0,1.97882164,1.797673434,POLD2
response to lipid (GO:0033993),2/114,0.406192275,0.532469667,0,0,1.449527745,1.30592107,IL1B;S100A8
positive regulation of kinase activity (GO:0033674),2/114,0.406192275,0.532469667,0,0,1.449527745,1.30592107,CSF1;MET
regulation of protein phosphorylation (GO:0001932),4/266,0.408205113,0.533895196,0,0,1.240076336,1.11109042,PAK1;IL1B;PLAUR;CAMKK2
cellular glucose homeostasis (GO:0001678),1/43,0.410442918,0.533895196,0,0,1.931608858,1.720133258,HK2
development of primary male sexual characteristics (GO:0046546),1/43,0.410442918,0.533895196,0,0,1.931608858,1.720133258,MEA1
DNA synthesis involved in DNA repair (GO:0000731),1/43,0.410442918,0.533895196,0,0,1.931608858,1.720133258,POLD2
glutathione metabolic process (GO:0006749),1/43,0.410442918,0.533895196,0,0,1.931608858,1.720133258,CNDP2
heart looping (GO:0001947),1/43,0.410442918,0.533895196,0,0,1.931608858,1.720133258,MICAL2
positive regulation of phospholipase C activity (GO:0010863),1/43,0.410442918,0.533895196,0,0,1.931608858,1.720133258,PHB
male gonad development (GO:0008584),1/43,0.410442918,0.533895196,0,0,1.931608858,1.720133258,MEA1
cellular amide metabolic process (GO:0043603),2/115,0.410445121,0.533895196,0,0,1.436626929,1.279335024,MTHFD2;AEBP1
cation transmembrane transport (GO:0098655),1/44,0.417650998,0.538652689,0,0,1.886592018,1.647200713,SFXN1
positive regulation of biosynthetic process (GO:0009891),1/44,0.417650998,0.538652689,0,0,1.886592018,1.647200713,MTPN
positive regulation of cell division (GO:0051781),1/44,0.417650998,0.538652689,0,0,1.886592018,1.647200713,CSPP1
positive regulation of cell-matrix adhesion (GO:0001954),1/44,0.417650998,0.538652689,0,0,1.886592018,1.647200713,CSF1
positive regulation of mRNA catabolic process (GO:0061014),1/44,0.417650998,0.538652689,0,0,1.886592018,1.647200713,METTL16
intracellular steroid hormone receptor signaling pathway (GO:0030518),1/44,0.417650998,0.538652689,0,0,1.886592018,1.647200713,PHB
positive regulation of potassium ion transmembrane transport (GO:1901381),1/44,0.417650998,0.538652689,0,0,1.886592018,1.647200713,FLNA
positive regulation of stress fiber assembly (GO:0051496),1/44,0.417650998,0.538652689,0,0,1.886592018,1.647200713,PAK1
mitotic spindle assembly (GO:0090307),1/44,0.417650998,0.538652689,0,0,1.886592018,1.647200713,FLNA
protein K63-linked ubiquitination (GO:0070534),1/44,0.417650998,0.538652689,0,0,1.886592018,1.647200713,TRAF3
action potential (GO:0001508),1/45,0.424771307,0.544137421,0,0,1.843621399,1.578516675,SCN5A
amino acid transmembrane transport (GO:0003333),1/45,0.424771307,0.544137421,0,0,1.843621399,1.578516675,SFXN1
regulation of insulin receptor signaling pathway (GO:0046626),1/45,0.424771307,0.544137421,0,0,1.843621399,1.578516675,IL1B
neural crest cell development (GO:0014032),1/45,0.424771307,0.544137421,0,0,1.843621399,1.578516675,NOLC1
regulation of pri-miRNA transcription by RNA polymerase II (GO:1902893),1/45,0.424771307,0.544137421,0,0,1.843621399,1.578516675,FOSL1
positive regulation of chemotaxis (GO:0050921),1/45,0.424771307,0.544137421,0,0,1.843621399,1.578516675,MET
positive regulation of response to biotic stimulus (GO:0002833),1/45,0.424771307,0.544137421,0,0,1.843621399,1.578516675,POLR3G
mitotic G2/M transition checkpoint (GO:0044818),1/45,0.424771307,0.544137421,0,0,1.843621399,1.578516675,HMGA2
alpha-amino acid metabolic process (GO:1901605),1/46,0.431804908,0.55128667,0,0,1.802560585,1.51375684,ALDH18A1
regulation of telomerase activity (GO:0051972),1/46,0.431804908,0.55128667,0,0,1.802560585,1.51375684,PINX1
positive regulation of smooth muscle cell proliferation (GO:0048661),1/46,0.431804908,0.55128667,0,0,1.802560585,1.51375684,PHB
postreplication repair (GO:0006301),1/46,0.431804908,0.55128667,0,0,1.802560585,1.51375684,POLD2
protein homooligomerization (GO:0051260),2/121,0.435640045,0.55571562,0,0,1.363775262,1.133214001,EHD1;SIGMAR1
determination of heart left/right asymmetry (GO:0061371),1/47,0.438752855,0.557811419,0,0,1.763285024,1.4526277,MICAL2
embryonic heart tube morphogenesis (GO:0003143),1/47,0.438752855,0.557811419,0,0,1.763285024,1.4526277,MICAL2
epithelial to mesenchymal transition (GO:0001837),1/47,0.438752855,0.557811419,0,0,1.763285024,1.4526277,HMGA2
histone deacetylation (GO:0016575),1/47,0.438752855,0.557811419,0,0,1.763285024,1.4526277,PHB
positive regulation of epithelial cell proliferation (GO:0050679),2/123,0.443909717,0.56276653,0,0,1.34109692,1.089150508,NME2;SCN5A
negative regulation of MAP kinase activity (GO:0043407),1/48,0.445616185,0.56276653,0,0,1.725680764,1.394863048,IL1B
regulation of interleukin-2 production (GO:0032663),1/48,0.445616185,0.56276653,0,0,1.725680764,1.394863048,IL1B
regulation of mitochondrion organization (GO:0010821),1/48,0.445616185,0.56276653,0,0,1.725680764,1.394863048,HAX1
positive regulation of blood vessel endothelial cell migration (GO:0043536),1/48,0.445616185,0.56276653,0,0,1.725680764,1.394863048,NUS1
histone H4 acetylation (GO:0043967),1/48,0.445616185,0.56276653,0,0,1.725680764,1.394863048,RUVBL2
substrate adhesion-dependent cell spreading (GO:0034446),1/48,0.445616185,0.56276653,0,0,1.725680764,1.394863048,PEAK1
myelination (GO:0042552),1/48,0.445616185,0.56276653,0,0,1.725680764,1.394863048,EIF2B5
defense response to symbiont (GO:0140546),2/124,0.448019418,0.565283273,0,0,1.33003658,1.067911247,NDUFAF4;FLNA
generation of neurons (GO:0048699),3/202,0.448353795,0.565283273,0,0,1.223357451,0.981343872,MTPN;IL1B;MET
regulation of protein secretion (GO:0050708),2/125,0.452112086,0.567082588,0,0,1.319156084,1.047179278,DNAJC1;IL1B
cellular defense response (GO:0006968),1/49,0.452395925,0.567082588,0,0,1.689643347,1.34022095,FOSL1
cellular response to mechanical stimulus (GO:0071260),1/49,0.452395925,0.567082588,0,0,1.689643347,1.34022095,IL1B
regulation of smooth muscle cell proliferation (GO:0048660),1/49,0.452395925,0.567082588,0,0,1.689643347,1.34022095,PHB
regulation of stress-activated MAPK cascade (GO:0032872),1/49,0.452395925,0.567082588,0,0,1.689643347,1.34022095,COPS5
response to glucose (GO:0009749),1/49,0.452395925,0.567082588,0,0,1.689643347,1.34022095,EIF2B5
inner mitochondrial membrane organization (GO:0007007),1/49,0.452395925,0.567082588,0,0,1.689643347,1.34022095,DNAJC11
actin polymerization or depolymerization (GO:0008154),1/50,0.459093089,0.57358297,0,0,1.655076846,1.288481101,MICAL2
negative regulation of ERK1 and ERK2 cascade (GO:0070373),1/50,0.459093089,0.57358297,0,0,1.655076846,1.288481101,PHB
regulation of cellular component movement (GO:0051270),1/50,0.459093089,0.57358297,0,0,1.655076846,1.288481101,ACTN1
positive regulation of ion transport (GO:0043270),1/50,0.459093089,0.57358297,0,0,1.655076846,1.288481101,SCN5A
regulation of protein kinase B signaling (GO:0051896),3/207,0.464192547,0.57709859,0,0,1.193068099,0.91562708,HAX1;PHB;MET
proteolysis (GO:0006508),4/287,0.465098644,0.57709859,0,0,1.146819788,0.87789715,CLPP;LAP3;AEBP1;CNDP2
regulation of axonogenesis (GO:0050770),1/51,0.465708678,0.57709859,0,0,1.621893004,1.239442516,PAK1
DNA duplex unwinding (GO:0032508),1/51,0.465708678,0.57709859,0,0,1.621893004,1.239442516,HMGA1
regulation of protein modification process (GO:0031399),1/51,0.465708678,0.57709859,0,0,1.621893004,1.239442516,PUM3
positive regulation of actin filament bundle assembly (GO:0032233),1/51,0.465708678,0.57709859,0,0,1.621893004,1.239442516,PAK1
gonad development (GO:0008406),1/51,0.465708678,0.57709859,0,0,1.621893004,1.239442516,MEA1
mesenchymal cell differentiation (GO:0048762),1/51,0.465708678,0.57709859,0,0,1.621893004,1.239442516,HMGA2
mitotic nuclear membrane organization (GO:0101024),1/51,0.465708678,0.57709859,0,0,1.621893004,1.239442516,REEP3
mitotic nuclear membrane reassembly (GO:0007084),1/51,0.465708678,0.57709859,0,0,1.621893004,1.239442516,REEP3
negative regulation of cellular biosynthetic process (GO:0031327),1/52,0.472243682,0.581399764,0,0,1.59001049,1.19292151,PRMT3
amide biosynthetic process (GO:0043604),1/52,0.472243682,0.581399764,0,0,1.59001049,1.19292151,SLC25A15
endocytic recycling (GO:0032456),1/52,0.472243682,0.581399764,0,0,1.59001049,1.19292151,EHD1
plasma membrane bounded cell projection morphogenesis (GO:0120039),1/52,0.472243682,0.581399764,0,0,1.59001049,1.19292151,PAK1
regulation of release of sequestered calcium ion into cytosol (GO:0051279),1/52,0.472243682,0.581399764,0,0,1.59001049,1.19292151,GSTO1
regulation of telomere maintenance via telomerase (GO:0032210),1/52,0.472243682,0.581399764,0,0,1.59001049,1.19292151,PINX1
